{
  "$schema": "../../../schemas/dishes.catalog.schema.json",
  "schemaVersion": "1.0.0",
  "updatedAt": "2026-01-19T00:00:00.000Z",
  "notes": [
    "SSA Ethiopian dishes catalog (V2 entries).",
    "All ids/tags are lowercase tokens matching ^[a-z0-9_.-]+$ per schema.",
    "If your ingredient/equipment ids differ, map via ingredients.aliases.json or cuisine rulesets."
  ],

  "meta": {
    "id": "cuisines.ethiopian.dishes",
    "type": "dishes_catalog",
    "domain": "cuisines",
    "locale": "en-US",
    "label": "Ethiopian • Dishes Catalog",
    "cuisineId": "cuisines.ethiopian",
    "status": "canonical",
    "notes": [
      "Designed for deterministic planners: coreComponents + signals + indexes.",
      "Pairs with cuisines.ethiopian cuisine.profile.json."
    ],
    "description": "Canonical Ethiopian dish entries for SSA planners, search, and UI browsing. Focused on injera platters, wot/wat stews, legume stews, sautéed sides, and core condiments.",
    "version": "1.0.0",
    "author": "SSA Catalog",
    "createdAt": "2026-01-19",
    "updatedAt": "2026-01-19"
  },

  "normalization": {
    "idPattern": "^[a-z0-9_\\.\\-]+$",
    "idCase": "lower",
    "aliasCaseFold": true,
    "keywordCaseFold": true,
    "trimWhitespace": true,
    "collapseSpaces": true
  },

  "dishes": [
    {
      "id": "dish.ethiopian.injera_platter",
      "label": "Injera_platter",
      "aka": ["Injera platter", "Injera with wot", "Injera platter (assorted)"],
      "subprofiles": [
        "cuisines.ethiopian.highlands",
        "cuisines.ethiopian.spicy_red"
      ],
      "category": "platter",
      "difficulty": 3,
      "heatTypical": 2,
      "time": { "activeMins": 30, "totalMins": 75, "handsOffMins": 45 },
      "servingStyles": ["family_style", "stew_and_starch", "holiday_feasts"],
      "mealArchetypes": ["archetype.injera_platter"],
      "signals": {
        "batchFriendly": "high",
        "weeknightPossible": true,
        "leftoversGood": true,
        "freezerFriendly": "medium"
      },
      "coreComponents": [
        {
          "role": "base",
          "items": ["starch.injera_teff", "starch.injera_blend"],
          "chooseOne": true
        },
        {
          "role": "stew",
          "items": [
            "dish.ethiopian.misir_wot",
            "dish.ethiopian.shiro",
            "dish.ethiopian.doro_wot",
            "dish.ethiopian.siga_wot"
          ],
          "chooseOne": false
        },
        {
          "role": "side",
          "items": [
            "dish.ethiopian.gomen",
            "dish.ethiopian.atkilt",
            "dish.ethiopian.timatem_salad"
          ],
          "chooseOne": false
        }
      ],
      "techniques": [
        "method.simmer",
        "method.saute",
        "method.bloom_spices_in_fat",
        "method.onion_reduction"
      ],
      "equipmentRecommended": [
        "tool.griddle",
        "tool.dutch_oven",
        "tool.blender",
        "tool.whisk"
      ],
      "equipmentMinimum": [
        "tool.heavy_pot",
        "tool.wooden_spoon",
        "tool.knife",
        "tool.cutting_board"
      ],
      "ingredientsCore": [
        "starch.injera_teff",
        "aromatic.onion",
        "aromatic.garlic",
        "aromatic.ginger",
        "spice.berbere",
        "fat.niter_kibbeh",
        "legume.red_lentils"
      ],
      "allergens": ["allergen.gluten", "allergen.dairy"],
      "dietFlags": ["diet.vegetarian_option", "diet.vegan_option"],
      "pairingHints": {
        "bestWith": [
          "dish.ethiopian.misir_wot",
          "dish.ethiopian.gomen",
          "dish.ethiopian.atkilt"
        ],
        "condiments": ["condiment.awaze", "condiment.green_chile"],
        "notes": "Use at least one mild side (atkilt or salad) to balance berbere heat."
      },
      "variations": [
        {
          "id": "dish.ethiopian.injera_platter.veg",
          "label": "Vegetarian_injera_platter",
          "when": { "diet": ["vegetarian", "vegan"] },
          "adapt": {
            "swapIn": [
              "dish.ethiopian.misir_wot",
              "dish.ethiopian.shiro",
              "dish.ethiopian.kik_alicha"
            ],
            "avoid": ["dish.ethiopian.doro_wot", "dish.ethiopian.siga_wot"]
          }
        },
        {
          "id": "dish.ethiopian.injera_platter.rice",
          "label": "Platter_over_rice",
          "when": { "missing": ["starch.injera_teff", "starch.injera_blend"] },
          "adapt": {
            "useBase": "starch.rice",
            "notes": "Serve stews bowl-style over rice when injera is unavailable."
          }
        }
      ],
      "plannerTags": [
        "cuisine.ethiopian",
        "platter",
        "family_style",
        "stew_and_starch",
        "batch_friendly"
      ]
    },

    {
      "id": "dish.ethiopian.doro_wot",
      "label": "Doro_wot",
      "aka": ["Doro wat", "Ethiopian chicken stew", "Spicy chicken wot"],
      "subprofiles": ["cuisines.ethiopian.spicy_red"],
      "category": "stew",
      "difficulty": 5,
      "heatTypical": 4,
      "time": { "activeMins": 45, "totalMins": 150, "handsOffMins": 105 },
      "servingStyles": ["family_style", "stew_and_starch", "holiday_feasts"],
      "mealArchetypes": ["archetype.wot_stew"],
      "signals": {
        "batchFriendly": "high",
        "weeknightPossible": false,
        "leftoversGood": true,
        "freezerFriendly": "high"
      },
      "coreComponents": [
        { "role": "protein", "items": ["protein.chicken"], "chooseOne": false },
        {
          "role": "base",
          "items": ["base.wot_onion_reduction"],
          "chooseOne": false
        },
        { "role": "spice", "items": ["spice.berbere"], "chooseOne": false },
        {
          "role": "fat",
          "items": ["fat.niter_kibbeh", "fat.ghee"],
          "chooseOne": true
        },
        {
          "role": "garnish",
          "items": ["protein.eggs", "garnish.lemon"],
          "chooseOne": false
        }
      ],
      "techniques": [
        "method.onion_reduction",
        "method.bloom_spices_in_fat",
        "method.simmer",
        "method.braise"
      ],
      "equipmentRecommended": ["tool.dutch_oven", "tool.thermometer"],
      "equipmentMinimum": [
        "tool.heavy_pot",
        "tool.wooden_spoon",
        "tool.knife",
        "tool.cutting_board"
      ],
      "ingredientsCore": [
        "protein.chicken",
        "aromatic.onion",
        "aromatic.garlic",
        "aromatic.ginger",
        "spice.berbere",
        "fat.niter_kibbeh",
        "umami.tomato_paste",
        "salt.kosher"
      ],
      "allergens": ["allergen.dairy", "allergen.eggs"],
      "dietFlags": [],
      "pairingHints": {
        "serveWith": [
          "starch.injera_teff",
          "dish.ethiopian.atkilt",
          "dish.ethiopian.gomen"
        ],
        "notes": "Traditionally served with hard-boiled eggs; keep a mild veg side to balance heat."
      },
      "variations": [
        {
          "id": "dish.ethiopian.doro_wot.dairy_free",
          "label": "Doro_wot_dairy_free",
          "when": { "avoidAllergens": ["allergen.dairy"] },
          "adapt": {
            "swapFat": { "from": "fat.niter_kibbeh", "to": "fat.neutral_oil" },
            "notes": "Bloom spices gently in oil; add extra aromatics for richness."
          }
        }
      ],
      "plannerTags": [
        "cuisine.ethiopian",
        "stew",
        "berbere",
        "holiday",
        "freezer_friendly",
        "batch_friendly"
      ]
    },

    {
      "id": "dish.ethiopian.misir_wot",
      "label": "Misir_wot",
      "aka": ["Misir wat", "Red lentil stew", "Berbere lentils"],
      "subprofiles": [
        "cuisines.ethiopian.highlands",
        "cuisines.ethiopian.spicy_red"
      ],
      "category": "legume_stew",
      "difficulty": 2,
      "heatTypical": 3,
      "time": { "activeMins": 20, "totalMins": 45, "handsOffMins": 25 },
      "servingStyles": ["family_style", "stew_and_starch", "one_pot"],
      "mealArchetypes": ["archetype.legume_stew", "archetype.wot_stew"],
      "signals": {
        "batchFriendly": "high",
        "weeknightPossible": true,
        "leftoversGood": true,
        "freezerFriendly": "high"
      },
      "coreComponents": [
        {
          "role": "legume",
          "items": ["legume.red_lentils"],
          "chooseOne": false
        },
        {
          "role": "base",
          "items": ["base.wot_onion_reduction", "aromatic.onion"],
          "chooseOne": true
        },
        { "role": "spice", "items": ["spice.berbere"], "chooseOne": false },
        {
          "role": "fat",
          "items": ["fat.niter_kibbeh", "fat.neutral_oil"],
          "chooseOne": true
        }
      ],
      "techniques": [
        "method.simmer",
        "method.bloom_spices_in_fat",
        "method.onion_reduction"
      ],
      "equipmentRecommended": ["tool.dutch_oven", "tool.immersion_blender"],
      "equipmentMinimum": [
        "tool.pot",
        "tool.wooden_spoon",
        "tool.knife",
        "tool.cutting_board"
      ],
      "ingredientsCore": [
        "legume.red_lentils",
        "aromatic.onion",
        "aromatic.garlic",
        "aromatic.ginger",
        "spice.berbere",
        "fat.niter_kibbeh",
        "salt.kosher"
      ],
      "allergens": ["allergen.dairy"],
      "dietFlags": ["diet.vegetarian", "diet.vegan_option"],
      "pairingHints": {
        "serveWith": [
          "starch.injera_teff",
          "dish.ethiopian.gomen",
          "dish.ethiopian.atkilt"
        ],
        "notes": "Finish with lemon if you want brighter balance."
      },
      "variations": [
        {
          "id": "dish.ethiopian.misir_wot.vegan",
          "label": "Misir_wot_vegan",
          "when": { "diet": ["vegan"] },
          "adapt": {
            "swapFat": { "from": "fat.niter_kibbeh", "to": "fat.neutral_oil" },
            "remove": ["allergen.dairy"]
          }
        }
      ],